{
  "$schema": "../../../tools/schemas/fable2-gpu-canary-subsystem-map-v1.schema.json",
  "schema_version": "1.0.0",
  "corpus": "Fable II Native Renderer G1.5B",
  "pinned_canary_commit": "3a44f20c7bc66db1da583e8a6f0ab740e31908e9",
  "confidence_vocabulary": [
    "CONFIRMED",
    "PROBABLE",
    "UNKNOWN",
    "NOT APPLICABLE"
  ],
  "subsystems": [
    {
      "id": "initialization",
      "title": "GPU initialization, ownership, memory, interrupts, and shutdown",
      "coverage": "FULL",
      "inputs": [
        "gpu backend cvar",
        "Emulator-owned Memory, Processor, and KernelState",
        "host window and graphics-provider capabilities"
      ],
      "persistent_state": [
        "GraphicsSystem owns GraphicsProvider, Presenter, RegisterFile, CommandProcessor, interrupt callback state, and vblank thread",
        "Emulator owns GraphicsSystem and the other top-level systems"
      ],
      "outputs": [
        "selected D3D12, Vulkan, or null GraphicsSystem",
        "GPU MMIO mapping",
        "running command and frame-limiter threads"
      ],
      "xenos_model": "The register file, command processor, ring MMIO, and interrupt callback model the console GPU-facing contract.",
      "host_compensation": "Provider selection, presenter creation, host device capability checks, and the host frame-limiter thread adapt that contract to host APIs.",
      "shared_vs_backend": "GraphicsSystem owns shared lifecycle; D3D12GraphicsSystem and VulkanGraphicsSystem create the provider and backend command processor.",
      "configuration": [
        "gpu selects any, d3d12, vulkan, or null",
        "any tries D3D12 before Vulkan on Windows",
        "provider capability checks may reject a backend"
      ],
      "symbols": [
        {
          "repository": "canary",
          "commit": "3a44f20c7bc66db1da583e8a6f0ab740e31908e9",
          "path": "src/xenia/app/xenia_main.cc",
          "type": "function",
          "symbol": "EmulatorApp::CreateGraphicsSystem",
          "confidence": "CONFIRMED",
          "role": "selects and constructs the graphics implementation"
        },
        {
          "repository": "canary",
          "commit": "3a44f20c7bc66db1da583e8a6f0ab740e31908e9",
          "path": "src/xenia/emulator.cc",
          "type": "function",
          "symbol": "Emulator::Setup",
          "confidence": "CONFIRMED",
          "role": "establishes system setup and shader-storage initialization"
        },
        {
          "repository": "canary",
          "commit": "3a44f20c7bc66db1da583e8a6f0ab740e31908e9",
          "path": "src/xenia/gpu/graphics_system.cc",
          "type": "function",
          "symbol": "GraphicsSystem::Setup",
          "confidence": "CONFIRMED",
          "role": "creates presenter, command processor, MMIO mapping, and limiter"
        }
      ],
      "unresolved": [
        "Static inspection cannot prove which backend or adapter a particular execution selects."
      ]
    },
    {
      "id": "command_processor",
      "title": "Ring buffer, PM4 packets, waits, events, interrupts, and swaps",
      "coverage": "FULL",
      "inputs": [
        "guest ring write pointer updates",
        "primary and indirect physical ring buffers",
        "type 0, 1, 2, and 3 PM4 packets"
      ],
      "persistent_state": [
        "ring base, size, read and write pointers",
        "GPU command XHostThread and queued host callbacks",
        "bin mask/select predication state and active shaders"
      ],
      "outputs": [
        "register writes",
        "draw, copy, resolve, query, interrupt, coherency, and swap operations",
        "ring read-pointer writeback"
      ],
      "xenos_model": "Packet parsing, ring and indirect-buffer traversal, waits, events, interrupts, and PM4 operation dispatch model the guest command stream.",
      "host_compensation": "The worker event loop, host sleeps while waiting, queued host functions, and backend Issue methods provide executable host scheduling.",
      "shared_vs_backend": "PM4 decoding is template-shared; IssueDraw, IssueCopy, IssueSwap, LoadShader, and synchronization are backend implementations.",
      "configuration": [
        "vsync influences wait sleeping",
        "gpu_allow_invalid_fetch_constants changes invalid fetch handling",
        "predicated swaps are deliberately skipped"
      ],
      "symbols": [
        {
          "repository": "canary",
          "commit": "3a44f20c7bc66db1da583e8a6f0ab740e31908e9",
          "path": "src/xenia/kernel/xboxkrnl/xboxkrnl_video.cc",
          "type": "function",
          "symbol": "VdSwap_entry",
          "confidence": "CONFIRMED",
          "role": "constructs the XE_SWAP packet in the guest ring"
        },
        {
          "repository": "canary",
          "commit": "3a44f20c7bc66db1da583e8a6f0ab740e31908e9",
          "path": "src/xenia/gpu/command_processor.cc",
          "type": "function",
          "symbol": "CommandProcessor::WorkerThreadMain",
          "confidence": "CONFIRMED",
          "role": "runs the command worker and drains the ring"
        },
        {
          "repository": "canary",
          "commit": "3a44f20c7bc66db1da583e8a6f0ab740e31908e9",
          "path": "src/xenia/gpu/pm4_command_processor_implement.h",
          "type": "function",
          "symbol": "COMMAND_PROCESSOR::ExecutePacket",
          "confidence": "CONFIRMED",
          "role": "decodes PM4 packet types and dispatches type 3 opcodes"
        }
      ],
      "unresolved": [
        "Static source cannot establish the packet mix or wait conditions produced by any title.",
        "INVALIDATE_STATE has no implemented cache action at this revision."
      ]
    },
    {
      "id": "register_state",
      "title": "Register definitions, writes, dirty state, coherency, and triggers",
      "coverage": "FULL",
      "inputs": [
        "type 0 and type 1 packet writes",
        "type 3 SET_* register packets",
        "kernel-created fetch and swap state"
      ],
      "persistent_state": [
        "0x5003-dword RegisterFile with generated metadata and reset defaults",
        "backend constant-buffer and texture-fetch binding validity"
      ],
      "outputs": [
        "draw-time Xenos state",
        "scratch writebacks and interrupts",
        "backend binding invalidation"
      ],
      "xenos_model": "Register storage, reset values, scratch behavior, gamma writes, and COHER status represent guest-visible GPU state.",
      "host_compensation": "Backend-specific WriteRegister paths invalidate host-side constant and texture bindings so lazily assembled host state is refreshed.",
      "shared_vs_backend": "Common storage and side effects are shared; D3D12 and Vulkan add different binding invalidation.",
      "configuration": [
        "no global universal dirty bit exists",
        "COHER_STATUS_HOST clears status and calls MakeCoherent"
      ],
      "symbols": [
        {
          "repository": "canary",
          "commit": "3a44f20c7bc66db1da583e8a6f0ab740e31908e9",
          "path": "src/xenia/gpu/register_file.cc",
          "type": "function",
          "symbol": "RegisterFile::RegisterFile",
          "confidence": "CONFIRMED",
          "role": "initializes the register file and defaults"
        },
        {
          "repository": "canary",
          "commit": "3a44f20c7bc66db1da583e8a6f0ab740e31908e9",
          "path": "src/xenia/gpu/command_processor.cc",
          "type": "function",
          "symbol": "CommandProcessor::WriteRegister",
          "confidence": "CONFIRMED",
          "role": "applies common write side effects"
        },
        {
          "repository": "canary",
          "commit": "3a44f20c7bc66db1da583e8a6f0ab740e31908e9",
          "path": "src/xenia/gpu/command_processor.cc",
          "type": "function",
          "symbol": "CommandProcessor::MakeCoherent",
          "confidence": "CONFIRMED",
          "role": "handles the guest coherency trigger"
        }
      ],
      "unresolved": [
        "MakeCoherent contains a TODO to notify resource caches, so full hardware coherency semantics are not implemented."
      ]
    },
    {
      "id": "draw_queries",
      "title": "Draw initiation, primitive processing, predication, and queries",
      "coverage": "FULL",
      "inputs": [
        "DRAW_INDX and DRAW_INDX_2 packet payloads",
        "register file and active vertex/pixel shaders",
        "guest index data and query packets"
      ],
      "persistent_state": [
        "primitive-conversion cache and memory watches",
        "draw extent estimator state",
        "query report lifecycle and backend query objects"
      ],
      "outputs": [
        "copy/resolve operation or host draw",
        "converted indices and normalized topology",
        "occlusion report data"
      ],
      "xenos_model": "Initiator fields, primitive restart, index endian, tessellation cases, report events, and query semantics decode guest behavior.",
      "host_compensation": "Unsupported host topologies are converted; point and rectangle cases can be expanded in shaders; host queries or shader counters approximate visibility.",
      "shared_vs_backend": "PM4 draw parsing, primitive processing, draw extents, and ZPD lifecycle are shared; host draw and query mechanisms are backend-specific.",
      "configuration": [
        "occlusion_query selects fake, fast, fast-alt, or strict behavior",
        "draw extent estimation may CPU-interpret the vertex shader and otherwise falls back",
        "VIZ_QUERY returns a fake visible result and is not full host conditional rendering"
      ],
      "symbols": [
        {
          "repository": "canary",
          "commit": "3a44f20c7bc66db1da583e8a6f0ab740e31908e9",
          "path": "src/xenia/gpu/pm4_command_processor_implement.h",
          "type": "function",
          "symbol": "COMMAND_PROCESSOR::ExecutePacketType3Draw",
          "confidence": "CONFIRMED",